{
  "format_version": 2,
  "id": "example",
  "kind": "feature",
  "title": "One useful reversible outcome",
  "author": "proposal-author-session",
  "created": "2026-10-05",
  "priority": 2,
  "proposal": "docs/features/example/proposal.md",
  "requirements": [
    "docs/decisions/20261005-proportionate-development-review.md"
  ],
  "owner_decision_required": false,
  "decision": null,
  "authorization": null,
  "requirement_rechecks": [],
  "checks": [
    {
      "id": "offline-journey",
      "description": "Run the scoped behavior and regression checks; record actual results.",
      "environment": "offline"
    }
  ],
  "tasks": [
    {
      "id": "implement",
      "title": "Implement and validate the offline journey",
      "status": "pending",
      "environment": "offline",
      "depends_on": [],
      "checks": [
        "offline-journey"
      ],
      "human_task": null,
      "blocker": null,
      "implementation": null,
      "evidence": [],
      "verification": null,
      "validation": null,
      "repeats": 0,
      "resumption": null,
      "review_policy": "self",
      "review_reason": "Replace with the actual effects and recovery assessment; a label is not evidence of safety.",
      "hazards": [],
      "owned_paths": [
        "scripts/example.py",
        "docs/features/example/evidence.md"
      ],
      "input_paths": []
    }
  ]
}
